title,summary,url,published,sentiment_score,sentiment_label,source_api,text_for_sentiment,relevance_score,full_text_fetched,relevance
Hosur emerges as aerospace hub with Rolls-Royce-HAL expansion - The New Indian Express,Hosur emerges as aerospace hub with Rolls-Royce-HAL expansion  The New Indian Express,https://news.google.com/rss/articles/CBMixAFBVV95cUxPdVF3M19abmdteGRjMlRUOHpwUlhjOEpVR1NoUENhaVYyWWFVZGV1d0hsd3JXa2pwZzZ5S2VnX3BrLTBCemZaYmRFTGc4RGlPZXFKQncyWGZOZzlaWGQ2aVc2cUxIdlVHc3dxaFdWdGdZSV9KNnU2aF94emo3d0s2NzhkcWZHUmk0b2xCUG1IYTRoemZhdHRRS0V6eTVLQk9HTzR4Qm9Oa0hkb2pIME5jNDk1a2JCRFNZRWM0MTBseThXT01Z0gHSAUFVX3lxTE1tNk5wVlFvQ3V3MjRNdHlVSWZZUmc5QTQ1enkyaksxbFRlSEJPdmlNZ3RBWlJMZjRMUWh3OFhzRDNjYVg0WEE2V095Zk5hTm5yUU5pYjVQV3d2Y1lkRlJWamFOYzdiQUt0QjdXUnNvMDBXcmdmZV9YZ09jWW9TallRSGNTOWI4LV91bnJtQ3EzYjZiUjN2TlU3QWR5dzR2YUZIZTNaYXFraFdjN1BudThyUXlGQ0VvRF9qaktKSVZHUWZFZW1CRTZzSHVHVXZDbzVFQQ?oc=5&hl=en-IN&gl=IN&ceid=IN:en,"Wed, 13 May 2026 07:00:00 GMT",,,GNews,Hosur emerges as aerospace hub with Rolls-Royce-HAL expansion  The New Indian Express,0.425,,
"Stocks making big moves yesterday: HighPeak Energy, Zscaler, Halliburton, Viasat, and CrowdStrike","This article details the performance of five stocks that experienced significant movement yesterday: HighPeak Energy, Zscaler, Halliburton, Viasat, and CrowdStrike. HighPeak Energy and Halliburton both saw declines due to a drop in WTI crude oil prices, while Zscaler and CrowdStrike fell after Zscaler's Q3 fiscal results. Viasat, however, rose following a major contract win from the U.S. Space Force.",https://www.theglobeandmail.com/investing/markets/stocks/ZS/pressreleases/2176875/stocks-making-big-moves-yesterday-highpeak-energy-zscaler-halliburton-viasat-and-crowdstrike/,20260528T130944,-0.328913,Somewhat-Bearish,AlphaVantage,"This article details the performance of five stocks that experienced significant movement yesterday: HighPeak Energy, Zscaler, Halliburton, Viasat, and CrowdStrike. HighPeak Energy and Halliburton both saw declines due to a drop in WTI crude oil prices, while Zscaler and CrowdStrike fell after Zscaler's Q3 fiscal results. Viasat, however, rose following a major contract win from the U.S. Space Force.",0.425,,
Hindustan Aeronautics Ltd Technical Momentum Shifts Amid Mixed Indicator Signals - Markets Mojo,Hindustan Aeronautics Ltd Technical Momentum Shifts Amid Mixed Indicator Signals  Markets Mojo,https://news.google.com/rss/articles/CBMi1AFBVV95cUxNUFhDQlNFNWZhMEt5RTJnYzdPekRydnM4dXo3XzlRbzRUdXRZbHhmOFdMeTQzNDlGRW9XVnFKU0dwSHVYVXBmYU00Y3o4Q1o0dFkxNy1sYkJndngwQWlQd2hSaFlzTnA1QkF5RXJ4RTFlRHRFVEhvU3N1dkJSWm05d3BwNnlKZUhXUUpVeDl2Zzl6UmlpeWlBQzVTUnJ4eFBWUGVDSTYyTDFKRk9pMmloN2FURjBUSi1LVHU1UTI3dUVZdVFhektZWGduTldiUnowNnJzTw?oc=5&hl=en-IN&gl=IN&ceid=IN:en,"Fri, 29 May 2026 05:34:09 GMT",,,GNews,Hindustan Aeronautics Ltd Technical Momentum Shifts Amid Mixed Indicator Signals  Markets Mojo,0.25,,
India's Hindustan Aeronautics posts quarterly profit rise as 'other income' surges - Reuters,India's Hindustan Aeronautics posts quarterly profit rise as 'other income' surges  Reuters,https://news.google.com/rss/articles/CBMiwgFBVV95cUxNMHE3bEYwNzg4d2N5aHhKSm1MUTJwNVRJTDlqNlcxTGVON2htdFFlRGVsQWU2clE0QzJDV1Y1cERmSTZpSy1tWjhQdHJFX3BIUzBZYjdOSUNucEhwcGg3VFhIWGhwQ1ZXWm1ZeUM5V2JMNWNNQUxTYWhyVEpxVXpzVzRFOE81UTlSQTNmY20zSG9WQ1MtbUtIbll0OC1zcG1PNU5MOEtxZXdER05fTW5CYUY2QllkaDZ3S0RmazB5bU5uUQ?oc=5&hl=en-IN&gl=IN&ceid=IN:en,"Thu, 14 May 2026 07:00:00 GMT",,,GNews,India's Hindustan Aeronautics posts quarterly profit rise as 'other income' surges  Reuters,0.25,,
Air India A319 may have passed within 100ft of Indian navy Dhruv helicopter - FlightGlobal,"***Incident transcript suggests Air India A319 had to descend sharply to avoid Indian navy helicopter.***. An Air India Airbus A319 departing Port Blair in 2024 had an airprox incident with an Indian Navy Hindustan Aeronautics ALH Dhruv Mk III helicopter. The incident occurred about 08:00 local time on 2 February 2024 after the aircraft (VT-SCV) took off from runway 22 in clear conditions to operate service AIC788 to Kolkata, according to a final report by India’s Aircraft Accident Investigation Bureau. Prior to the A319 taking off with instructions to climb to 4,000ft, navy controllers – who manage air traffic control at Port Blair – had cleared the helicopter, which was conducting a training flight, for the outbound leg of an ILS practice approach to runway 04. According to the report’s text, the A319 crew did not receive a TCAS notification but spotted the helicopter visually and descended to avoid it.",https://www.flightglobal.com/defence/2026/05/air-india-a319-may-have-passed-within-100ft-of-indian-navy-dhruv-helicopter/,,,,Tavily,"***Incident transcript suggests Air India A319 had to descend sharply to avoid Indian navy helicopter.***. An Air India Airbus A319 departing Port Blair in 2024 had an airprox incident with an Indian Navy Hindustan Aeronautics ALH Dhruv Mk III helicopter. The incident occurred about 08:00 local time on 2 February 2024 after the aircraft (VT-SCV) took off from runway 22 in clear conditions to operate service AIC788 to Kolkata, according to a final report by India’s Aircraft Accident Investigation Bureau. Pri",0.25,,0.17233925
Hindustan Aeronautics Ltd Sees High-Value Trading Amid Sector Weakness - Markets Mojo,Hindustan Aeronautics Ltd Sees High-Value Trading Amid Sector Weakness  Markets Mojo,https://news.google.com/rss/articles/CBMixwFBVV95cUxPS1lCakhuLThjUUNPUzJ3UnFtM19aOXFKTHdGU1o2bVFZcFFwZHBERjItejFGR2tSblREbmJWaWVDeGdwbFd6RDJ2M3FHYzh3ekRqNnpSQ2p0VHVsWllTcUpfdWJJd0dwNTNvTlJlN2lZVnNwalg3Q2dOOGpybTIwTlg2dVBWVC1mZmpiYjAxT2tEVlJkZ1VxamxkUER4aEhhU1JkN0dZd2Z2RXRjdUlSRFZsZFZFS2ZaWnp0WEFyZ3AzR1g5LTVr?oc=5&hl=en-IN&gl=IN&ceid=IN:en,"Wed, 27 May 2026 21:09:09 GMT",,,GNews,Hindustan Aeronautics Ltd Sees High-Value Trading Amid Sector Weakness  Markets Mojo,0.25,,
"Helix Energy Solutions and TechnipFMC Shares Plummet, What You Need To Know","A number of stocks fell in the morning session after WTI crude oil plunged on Iran-US peace deal progress and renewed hopes for reopening the Strait of Hormuz. Oilfield services companies (Schlumberger (SLB), Halliburton (HAL), Baker Hughes (BKR), TechnipFMC, and the offshore drillers) get paid only when oil producers spend money drilling new wells.",https://finnhub.io/api/news?id=43478b3818cd986c743d080c96e2f5800591831ac013829c8557ad5f4c4f9392,2026-05-28T03:15:24,,,Finnhub,"A number of stocks fell in the morning session after WTI crude oil plunged on Iran-US peace deal progress and renewed hopes for reopening the Strait of Hormuz. Oilfield services companies (Schlumberger (SLB), Halliburton (HAL), Baker Hughes (BKR), TechnipFMC, and the offshore drillers) get paid only when oil producers spend money drilling new wells.",0.125,,
CapitalNumbers Infotech Limited Announces H2 FY26 & FY26 Results,,https://www.business-standard.com/content/press-releases-ani/capitalnumbers-infotech-limited-announces-h2-fy26-fy26-results-126053000825_1.html,,,,BusinessStandard,CapitalNumbers Infotech Limited Announces H2 FY26 & FY26 Results,0.125,,
Indian ADRs - 3 Conviction Buys?,"<!-- SC_OFF --><div class=""md""><p>The following 3 Indian ADRs screened as Top Buys in July's Indian Quant Model. Is it time to add these stocks to your portfolio if you are looking for attractive emerging market names? </p> <p>Colgate-Palmolive (CLGQY) </p> <p>Colgate-Palmolive (India) Limited manufactures and sells oral care and personal care products in India. </p> <ul> <li>Revenue grew by 5.18&",https://www.reddit.com/r/StockMarket/comments/8xpkgm/indian_adrs_3_conviction_buys/,2018-07-10T14:20:20+00:00,,,Reddit_r/StockMarket,"<!-- SC_OFF --><div class=""md""><p>The following 3 Indian ADRs screened as Top Buys in July's Indian Quant Model. Is it time to add these stocks to your portfolio if you are looking for attractive emerging market names? </p> <p>Colgate-Palmolive (CLGQY) </p> <p>Colgate-Palmolive (India) Limited manufactures and sells oral care and personal care products in India. </p> <ul> <li>Revenue grew by 5.18&",0.125,,
What does the future hold for Cyient stock?,"Over the last few years, Cyient stock has been plagued by revenue growth challenges and margin pressures at the company.",https://www.livemint.com/market/stock-market-news/cyient-share-price-indian-defence-stocks-cyient-stock-price-outlook-11780052822751.html,"Sat, 30 May 2026 07:01:08 +0530",,,Livemint,"Equitymaster

Equitymaster is India's leading independent equity research platform, providing in-depth research and analysis on BSE- and NSE-listed companies since 1996. As a SEBI-registered Research Analyst [Registration No. INH000021128], Equitymaster covers the full spectrum of Indian equities — bluechip stocks, midcap stocks, smallcap stocks, and microcap stocks.<br><br> At the heart of Equitymaster's research philosophy are the principles of value investing — particularly the margin of safety and the p",0.125,True,
Space Rally Gets Reality Check With Blue Origin Blowup,"A weeks-long rally in space-related stocks came to an abrupt halt on Friday, with the explosion of a Blue Origin rocket serving as a glaring reminder of the risks that come with the potential riches investors hope to reap from the blossoming industry.",https://www.livemint.com/market/space-rally-gets-reality-check-with-blue-origin-blowup-11780099282942.html,"Sat, 30 May 2026 05:31:22 +0530",,,Livemint,"A weeks-long rally in space-related stocks came to an abrupt halt on Friday, with the explosion of a Blue Origin rocket serving as a glaring reminder of the risks that come with the potential riches investors hope to reap from the blossoming industry.",0.125,,
JD Cables Limited Reports Strong H2 FY26 & FY26 Performance,,https://www.business-standard.com/content/press-releases-ani/jd-cables-limited-reports-strong-h2-fy26-fy26-performance-126053001254_1.html,,,,BusinessStandard,JD Cables Limited Reports Strong H2 FY26 & FY26 Performance,0.125,,
"LGT Global Hospitality Limited Reports Strong FY26 Performance; Accelerates Growth Through Strategic Collaborations, Acquisitions & Expansion Initiatives",,https://www.business-standard.com/content/press-releases-ani/lgt-global-hospitality-limited-reports-strong-fy26-performance-accelerates-growth-through-strategic-collaborations-acquisitions-expansion-initiatives-126053001217_1.html,,,,BusinessStandard,"LGT Global Hospitality Limited Reports Strong FY26 Performance; Accelerates Growth Through Strategic Collaborations, Acquisitions & Expansion Initiatives",0.125,,
NASA partners with Canoo (GOEV),"<!-- SC_OFF --><div class=""md""><p><strong>Justin, TX April 13, 2022</strong> – The National Aeronautics and Space Administration (NASA) has selected Canoo Inc. (Nasdaq: GOEV) a high-tech advanced mobility company to provide Crew Transportation Vehicles (CTVs) for crewed Artemis lunar exploration launches. Canoo will deliver multiple customized all-electric LV models to NASA by June 2023.</p> <p>📷📷",https://www.reddit.com/r/wallstreetbets/comments/u2pvbm/nasa_partners_with_canoo_goev/,2022-04-13T13:04:33+00:00,,,Reddit_r/wallstreetbets,"<!-- SC_OFF --><div class=""md""><p><strong>Justin, TX April 13, 2022</strong> – The National Aeronautics and Space Administration (NASA) has selected Canoo Inc. (Nasdaq: GOEV) a high-tech advanced mobility company to provide Crew Transportation Vehicles (CTVs) for crewed Artemis lunar exploration launches. Canoo will deliver multiple customized all-electric LV models to NASA by June 2023.</p> <p>📷📷",0.125,,
"Vedanta’s board to consider voluntary delisting proposal on May 18, 2020","<!-- SC_OFF --><div class=""md""><p>Vedanta Limited promoter Anil Agarwal will take his mining and oil- and power-producing company private. The company informed the stock exchanges about the decision by its parent Vedanta Resources, promoted by the billionaire. The promoter holding in the company is 50.14% while the public holds 49.46%.</p> <p>The Vedanta stock closed 12.2% up at Rs 89.30 today on ",https://www.reddit.com/r/IndiaInvestments/comments/gidnlr/vedantas_board_to_consider_voluntary_delisting/,2020-05-12T15:43:41+00:00,,,Reddit_r/IndiaInvestments,"<!-- SC_OFF --><div class=""md""><p>Vedanta Limited promoter Anil Agarwal will take his mining and oil- and power-producing company private. The company informed the stock exchanges about the decision by its parent Vedanta Resources, promoted by the billionaire. The promoter holding in the company is 50.14% while the public holds 49.46%.</p> <p>The Vedanta stock closed 12.2% up at Rs 89.30 today on ",0.125,,
Stock market and its returns,"<!-- SC_OFF --><div class=""md""><p>Hello .I am from India. my portfolio consists of 31 stocks out of which 60 % are large cap and 40% are mid cap. If I invest 2 lakhs into each of my stocks , then can I get a return of 6 crores in 10 years .if most of my stocks give a cagr of 20-26% , then I can get 10x returns ?</p> <p>Pidilite - 3x , Hindustan Unilever - 2.69x, Tata consultancy services ( TCS ) -",https://www.reddit.com/r/StockMarket/comments/ojiojz/stock_market_and_its_returns/,2021-07-13T16:03:20+00:00,,,Reddit_r/StockMarket,"<!-- SC_OFF --><div class=""md""><p>Hello .I am from India. my portfolio consists of 31 stocks out of which 60 % are large cap and 40% are mid cap. If I invest 2 lakhs into each of my stocks , then can I get a return of 6 crores in 10 years .if most of my stocks give a cagr of 20-26% , then I can get 10x returns ?</p> <p>Pidilite - 3x , Hindustan Unilever - 2.69x, Tata consultancy services ( TCS ) -",0.125,,
Which Stock will you pick from each sector from Nifty if you are building a portfolio for 10+ years? And why?,"<!-- SC_OFF --><div class=""md""><table><thead> <tr> <th>Sector</th> <th>Stock</th> </tr> </thead><tbody> <tr> <td>Auto</td> <td>Tata Motors Limited</td> </tr> <tr> <td>Auto</td> <td>Mahindra &amp; Mahindra Limited</td> </tr> <tr> <td>Auto</td> <td>Maruti Suzuki India Limited</td> </tr> <tr> <td>Auto</td> <td>Bajaj Auto Limited</td> </tr> <tr> <td>Auto</td> <td>Hero MotoCorp Limited</td> </tr> <tr> ",https://www.reddit.com/r/IndiaInvestments/comments/3x6mi1/which_stock_will_you_pick_from_each_sector_from/,2015-12-17T06:30:06+00:00,,,Reddit_r/IndiaInvestments,"<!-- SC_OFF --><div class=""md""><table><thead> <tr> <th>Sector</th> <th>Stock</th> </tr> </thead><tbody> <tr> <td>Auto</td> <td>Tata Motors Limited</td> </tr> <tr> <td>Auto</td> <td>Mahindra &amp; Mahindra Limited</td> </tr> <tr> <td>Auto</td> <td>Maruti Suzuki India Limited</td> </tr> <tr> <td>Auto</td> <td>Bajaj Auto Limited</td> </tr> <tr> <td>Auto</td> <td>Hero MotoCorp Limited</td> </tr> <tr> ",0.125,,
How long does consumer goods need to grow to justify current valuations?,"<!-- SC_OFF --><div class=""md""><p>Some of the consumer goods companies are trading at a premium to historic valuations. Some growth stocks have never been cheap in their entire lifetime on a price to earning basis. How many years of growth is priced in growth stocks?</p> <p>Here are the top consumer goods stocks in Nifty 100 and in Nifty FMCG Index</p> <p>Hindustan Unilever – Trading at 69.43 PE N",https://www.reddit.com/r/IndiaInvestments/comments/iwafux/how_long_does_consumer_goods_need_to_grow_to/,2020-09-20T08:57:06+00:00,,,Reddit_r/IndiaInvestments,"<!-- SC_OFF --><div class=""md""><p>Some of the consumer goods companies are trading at a premium to historic valuations. Some growth stocks have never been cheap in their entire lifetime on a price to earning basis. How many years of growth is priced in growth stocks?</p> <p>Here are the top consumer goods stocks in Nifty 100 and in Nifty FMCG Index</p> <p>Hindustan Unilever – Trading at 69.43 PE N",0.125,,
"Given Virgin Galactic going public, thoughts on this Space Portfolio?","<!-- SC_OFF --><div class=""md""><p><a href=""https://m1.finance/xYDLqtHLn""><strong>Link to portfolio</strong></a></p> <p>&#x200b;</p> <p>Goals:</p> <p>-Maintain holdings in broad array of companies involved in aeronautical engineering, research, and manufacturing.</p> <p>-Donate half of all income distributions to organizations promoting space travel and public interest (personal goal, I wouldn't re",https://www.reddit.com/r/investing/comments/cbouf7/given_virgin_galactic_going_public_thoughts_on/,2019-07-11T00:30:28+00:00,,,Reddit_r/investing,"<!-- SC_OFF --><div class=""md""><p><a href=""https://m1.finance/xYDLqtHLn""><strong>Link to portfolio</strong></a></p> <p>&#x200b;</p> <p>Goals:</p> <p>-Maintain holdings in broad array of companies involved in aeronautical engineering, research, and manufacturing.</p> <p>-Donate half of all income distributions to organizations promoting space travel and public interest (personal goal, I wouldn't re",0.125,,
"Given Virgin Galactic going public, thoughts on this Space Portfolio? [X-post from r/investing]","<!-- SC_OFF --><div class=""md""><p>Goals:</p> <p>-Maintain holdings in broad array of companies involved in aeronautical engineering, research, and manufacturing.</p> <p>-Donate half of all income distributions to organizations promoting space travel and public interest (personal goal, I wouldn't recommend if investing purely for profit)</p> <p>&#x200b;</p> <p>Performance Since 2017 (<a href=""https",https://www.reddit.com/r/stocks/comments/cbxqdm/given_virgin_galactic_going_public_thoughts_on/,2019-07-11T16:30:46+00:00,,,Reddit_r/stocks,"<!-- SC_OFF --><div class=""md""><p>Goals:</p> <p>-Maintain holdings in broad array of companies involved in aeronautical engineering, research, and manufacturing.</p> <p>-Donate half of all income distributions to organizations promoting space travel and public interest (personal goal, I wouldn't recommend if investing purely for profit)</p> <p>&#x200b;</p> <p>Performance Since 2017 (<a href=""https",0.125,,
Citadel Securities Loses Court Fight Over New IEX Options Venue,"Citadel Securities lost its bid to block IEX Group Inc. from launching a new type of options exchange that intentionally slows orders, after a federal appeals court on Friday rejected the market maker’s challenge.",https://www.livemint.com/market/citadel-securities-loses-court-fight-over-new-iex-options-venue-11780092846337.html,"Sat, 30 May 2026 03:44:05 +0530",,,Livemint,"Citadel Securities lost its bid to block IEX Group Inc. from launching a new type of options exchange that intentionally slows orders, after a federal appeals court on Friday rejected the market maker’s challenge.",0.125,,
Hindustan Zinc Joins Dow Jones ESG Index - Construction World,"The inclusion marks the company’s first entry into the global ESG benchmark index.Formerly known as the Dow Jones Sustainability Index, the benchmark tracks companies demonstrating strong environmental, social and governance (ESG) performance across global markets. Hindustan Zinc is among only 25 Indian companies included in the emerging markets index and one of only two companies from India’s metals and mining sector.The company was earlier ranked as the world’s most sustainable metals and mining company in the S&P Global Corporate Sustainability Assessment 2025. It also became the first Indian mining company to join the International Council on Mining and Metals (ICMM).Arun Misra, CEO, Hindustan Zinc, said the recognition reflects the company’s focus on responsible resource production, transparency and sustainable growth.Hindustan Zinc also highlighted initiatives including EcoZen, its low-carbon zinc product manufactured using renewable energy, and its roadmap to achieve net-zero emissions by 2050 or earlier. Hindustan Zinc is among only 25 Indian companies included in the emerging markets index and one of only two companies from India’s metals and mining sector.",https://www.constructionworld.in/resources-company-news/hindustan-zinc-joins-dow-jones-esg-index/91247,,,,Tavily,"The inclusion marks the company’s first entry into the global ESG benchmark index.Formerly known as the Dow Jones Sustainability Index, the benchmark tracks companies demonstrating strong environmental, social and governance (ESG) performance across global markets. Hindustan Zinc is among only 25 Indian companies included in the emerging markets index and one of only two companies from India’s metals and mining sector.The company was earlier ranked as the world’s most sustainable metals and mining company i",0.125,,0.15452935
Aerospace and Defence Stock Where Anand Rathi Sees 43% Upside Potential - Trade Brains,"This small-cap Defence Stock, engaged in precision engineering, manufacturing aerospace components, tooling solutions, and advanced assemblies for defence, semiconductor, and industrial sectors, is in focus after Anand Rathi assigned a Buy target of Rs. 1,435, which has an upside potential of 43.04 percent. With a market capitalization of Rs. 5,101.96 crore, the shares of **Unimech Aerospace and Manufacturing Limited** closed on Thursday at Rs. 1003.20 per equity share, down nearly 5 percent from its previous day’s close price of Rs. 1,055.95. Anand Rathi a prominent brokerage firm, has recommended a “Buy” call on Unimech Aerospace and Manufacturing Limited with a target price of Rs. 1,435 per share, indicating an upside potential of 43.04 percent from its previous day’s close price of Rs. 1003.20 per share. Anand Rathi holds a positive outlook on Unimech Aerospace and Manufacturing Ltd. The company’s acquisition of Hobel Bellows for Rs. 4.5 billion strengthens its capabilities in advanced engineering.",https://tradebrains.in/aerospace-and-defence-stock-where-anand-rathi-sees-43-upside-potential/,,,,Tavily,"This small-cap Defence Stock, engaged in precision engineering, manufacturing aerospace components, tooling solutions, and advanced assemblies for defence, semiconductor, and industrial sectors, is in focus after Anand Rathi assigned a Buy target of Rs. 1,435, which has an upside potential of 43.04 percent. With a market capitalization of Rs. 5,101.96 crore, the shares of **Unimech Aerospace and Manufacturing Limited** closed on Thursday at Rs. 1003.20 per equity share, down nearly 5 percent from its previo",0.125,,0.12350323
"Stealth, skies and sovereignty: India's fighter jet plan takes off","The Defence Ministry has issued tenders for India’s indigenous fifth-generation Advanced Medium Combat Aircraft (AMCA) programme to three private sector-led groups — Tata Advanced Systems, the Larsen & Toubro-Bharat Electronics Limited alliance, and the Bhara…",https://economictimes.indiatimes.com/news/defence/stealth-skies-and-sovereignty-indias-fighter-jet-plan-takes-off-tata-larsen-and-toubro-bharat-electronics-bharat-forge/articleshow/131354395.cms,2026-05-27T15:50:51Z,,,NewsAPI,"The Defence Ministry has issued tenders for India’s indigenous fifth-generation Advanced Medium Combat Aircraft (AMCA) programme to three private sector-led groups — Tata Advanced Systems, the Larsen & Toubro-Bharat Electronics Limited alliance, and the Bhara…",0.125,,
Apache vs Prachand: Why India operates both attack helicopters and how they differ,"India is acquiring support for Boeing AH-64E Apache attack helicopters. This acquisition renews discussions on India's use of foreign and indigenous platforms. The LCH Prachand, developed by HAL, is designed for high-altitude operations. The Apache is suited …",https://economictimes.indiatimes.com/news/defence/apache-vs-prachand-why-india-operates-both-attack-helicopters-and-how-they-differ/articleshow/131292786.cms,2026-05-24T12:55:57Z,,,NewsAPI,"India is acquiring support for Boeing AH-64E Apache attack helicopters. This acquisition renews discussions on India's use of foreign and indigenous platforms. The LCH Prachand, developed by HAL, is designed for high-altitude operations. The Apache is suited …",0.125,,
Census 2027: Self-Enumeration starts in Punjab - Babushahi.com,"* Apr 30, 2026Testing Ethanol 85 and Ethanol 100 as motor vehicle Fuel notified by Government of India * Apr 30, 2026One arrested for working of ISI, installing CCTV cameras in Kapurthala * Apr 30, 202623 elected to Bar Council of Punjab, Haryana and Chandigarh * Apr 30, 2026ICSE and ISC results declared * Apr 30, 202611 Punjabis Deported from Australia to land in Delhi today April 30 * Apr 30, 2026""Today Vande Bharat Will Start from Jammu"": Ashwini Vaishnaw announces extension to Srinagar, train upgraded to 20 coaches * Apr 30, 2026Bhagwant Mann allowed to meet President alone, but says will take MLAs along * Apr 30, 2026Punjab Cabinet meeting on May 1 * Apr 30, 2026Dalal Street tumbles as crude tops USD 120; Nifty slips 278 pts, Sensex down 914 pts in opening * Apr 30, 2026West Bengal records highest-ever poll-participation since Independence 91.66% poll-participation recorded in Phase-II * Apr 30, 2026Census 2027: Self-Enumeration starts in Punjab * Apr 30, 2026Narcotics smuggling network busted, one arrested with 6 Kg Heroin: DGP * Apr 30, 2026Rahul Gandhi to train Punjab Congress District Presidents * Apr 30, 2026Justice (retd.) Anupinder Singh Grewal appointed Chairman NCLT * Apr 30, 2026Canada: Five Punjabis arrested in Cargo Theft investigation, $2 Million Stolen Cannabis recovered.",https://www.babushahi.com/view-news.php?id=220443,,,,Tavily,"* Apr 30, 2026Testing Ethanol 85 and Ethanol 100 as motor vehicle Fuel notified by Government of India * Apr 30, 2026One arrested for working of ISI, installing CCTV cameras in Kapurthala * Apr 30, 202623 elected to Bar Council of Punjab, Haryana and Chandigarh * Apr 30, 2026ICSE and ISC results declared * Apr 30, 202611 Punjabis Deported from Australia to land in Delhi today April 30 * Apr 30, 2026""Today Vande Bharat Will Start from Jammu"": Ashwini Vaishnaw announces extension to Srinagar, train upgraded t",0.125,,0.15629826
